{
  "$schema": "../../../docs/contracts/artifact-contracts/module-interface-manifest.schema.json",
  "manifest_id": "koa-spaces.global-widgets",
  "manifest_version": "1.0.0",
  "module_id": "space_home",
  "public_name": "Home",
  "description": "Local non-authoritative home, search, and platform-status contribution for Koali Spaces.",
  "icon_ref": "icons/home.svg",
  "home_route_id": "space_home.home",
  "required_capabilities": [],
  "routes": [
    {
      "route_id": "space_home.home",
      "module_id": "space_home",
      "path": "/",
      "page_ref": "koa-spaces://page/home",
      "default_label": "Home",
      "label_key": "space_home.home",
      "availability": "always",
      "offline_behavior": "available",
      "deep_link_allowed": true,
      "safe_fallback_route_id": null,
      "aliases": [],
      "capability_policy": {
        "required_capabilities": [],
        "denied_behavior": "access_denied"
      }
    },
    {
      "route_id": "space_home.search",
      "module_id": "space_home",
      "path": "/search",
      "page_ref": "koa-spaces://page/search",
      "default_label": "Search",
      "label_key": "space_home.search",
      "availability": "always",
      "offline_behavior": "cached_read_only",
      "deep_link_allowed": true,
      "safe_fallback_route_id": "space_home.home",
      "aliases": [],
      "capability_policy": {
        "required_capabilities": [],
        "denied_behavior": "access_denied"
      }
    },
    {
      "route_id": "space_home.tasks",
      "module_id": "space_home",
      "path": "/tasks",
      "page_ref": "koa-spaces://page/tasks",
      "default_label": "Tasks",
      "label_key": "space_home.tasks",
      "availability": "always",
      "offline_behavior": "cached_read_only",
      "deep_link_allowed": true,
      "safe_fallback_route_id": "space_home.home",
      "aliases": [],
      "capability_policy": {
        "required_capabilities": [],
        "denied_behavior": "access_denied"
      }
    },
    {
      "route_id": "space_home.offline",
      "module_id": "space_home",
      "path": "/offline",
      "page_ref": "koa-spaces://page/offline",
      "default_label": "Offline",
      "label_key": "space_home.offline",
      "availability": "always",
      "offline_behavior": "available",
      "deep_link_allowed": true,
      "safe_fallback_route_id": "space_home.home",
      "aliases": [],
      "capability_policy": {
        "required_capabilities": [],
        "denied_behavior": "access_denied"
      }
    },
    {
      "route_id": "space_home.health",
      "module_id": "space_home",
      "path": "/health",
      "page_ref": "koa-spaces://page/health",
      "default_label": "Interface health",
      "label_key": "space_home.health",
      "availability": "always",
      "offline_behavior": "available",
      "deep_link_allowed": true,
      "safe_fallback_route_id": "space_home.home",
      "aliases": [],
      "capability_policy": {
        "required_capabilities": [],
        "denied_behavior": "access_denied"
      }
    },
    {
      "route_id": "space_home.settings",
      "module_id": "space_home",
      "path": "/settings",
      "page_ref": "koa-spaces://page/settings",
      "default_label": "Settings",
      "label_key": "space_home.settings",
      "availability": "always",
      "offline_behavior": "available",
      "deep_link_allowed": true,
      "safe_fallback_route_id": "space_home.home",
      "aliases": [],
      "capability_policy": {
        "required_capabilities": [],
        "denied_behavior": "access_denied"
      }
    }
  ],
  "sidebar": {
    "module_id": "space_home",
    "visible_depth": 2,
    "items": [
      {
        "item_id": "space_home.home",
        "label": "Home",
        "label_key": "space_home.home",
        "icon_ref": "icons/home.svg",
        "order": 0,
        "required_capabilities": [],
        "availability": "always",
        "badge_provider_ref": null,
        "route_id": "space_home.home"
      },
      {
        "item_id": "space_home.search",
        "label": "Search",
        "label_key": "space_home.search",
        "icon_ref": "icons/search.svg",
        "order": 10,
        "required_capabilities": [],
        "availability": "always",
        "badge_provider_ref": null,
        "route_id": "space_home.search"
      },
      {
        "item_id": "space_home.tasks",
        "label": "Tasks",
        "label_key": "space_home.tasks",
        "icon_ref": "icons/assignments.svg",
        "order": 20,
        "required_capabilities": [],
        "availability": "always",
        "badge_provider_ref": null,
        "route_id": "space_home.tasks"
      },
      {
        "item_id": "space_home.system",
        "label": "System",
        "label_key": "space_home.system",
        "icon_ref": "icons/network.svg",
        "order": 30,
        "required_capabilities": [],
        "availability": "always",
        "badge_provider_ref": null,
        "children": [
          {
            "item_id": "space_home.offline",
            "label": "Offline",
            "label_key": "space_home.offline",
            "icon_ref": "icons/network.svg",
            "order": 0,
            "required_capabilities": [],
            "availability": "always",
            "badge_provider_ref": null,
            "route_id": "space_home.offline"
          },
          {
            "item_id": "space_home.health",
            "label": "Interface health",
            "label_key": "space_home.health",
            "icon_ref": "icons/network.svg",
            "order": 10,
            "required_capabilities": [],
            "availability": "always",
            "badge_provider_ref": null,
            "route_id": "space_home.health"
          },
          {
            "item_id": "space_home.settings",
            "label": "Settings",
            "label_key": "space_home.settings",
            "icon_ref": null,
            "order": 20,
            "required_capabilities": [],
            "availability": "always",
            "badge_provider_ref": null,
            "route_id": "space_home.settings"
          }
        ]
      }
    ]
  },
  "topbar_widgets": [
    {
      "widget_id": "global.search",
      "module_id": "space_home",
      "scope": "module",
      "slot": "primary",
      "kind": "search",
      "label": "Search",
      "label_key": "global.search",
      "icon_ref": "icons/search.svg",
      "priority": 10,
      "required_capabilities": [],
      "offline_behavior": "cached_read_only",
      "compact_only": true,
      "activation": {
        "kind": "route",
        "route_id": "space_home.search"
      }
    },
    {
      "widget_id": "global.tasks",
      "module_id": "space_home",
      "scope": "module",
      "slot": "secondary",
      "kind": "action",
      "label": "Tasks",
      "label_key": "global.tasks",
      "icon_ref": "icons/assignments.svg",
      "priority": 15,
      "required_capabilities": [],
      "offline_behavior": "cached_read_only",
      "compact_only": true,
      "activation": {
        "kind": "route",
        "route_id": "space_home.tasks"
      }
    },
    {
      "widget_id": "global.network_state",
      "module_id": "space_home",
      "scope": "module",
      "slot": "status",
      "kind": "status",
      "label": "Network state",
      "label_key": "global.network_state",
      "icon_ref": "icons/network.svg",
      "priority": 20,
      "required_capabilities": [],
      "offline_behavior": "available",
      "compact_only": true,
      "activation": {
        "kind": "none"
      },
      "projection_ref": "space_home.network_state"
    }
  ],
  "localization_refs": [
    "localization/koa-spaces.en.json",
    "localization/koa-spaces.fr-CA.json"
  ],
  "accessibility": {
    "keyboard_navigation": true,
    "screen_reader_labels": true,
    "reduced_motion": "supported"
  },
  "offline_behavior": {
    "module_state": "available",
    "fallback_route_id": "space_home.home"
  },
  "authority_boundary": {
    "presentation_only": true,
    "may_grant_capabilities": false,
    "direct_domain_writes": false,
    "menu_visibility_is_authorization": false
  },
  "shell_compatibility": {
    "min_shell_version": "1.0.0",
    "max_shell_version": null
  },
  "design_system_compatibility": {
    "design_system_id": "koali.ant5",
    "min_version": "1.0.0"
  },
  "asset_bundle_ref": null,
  "surface_contract_version": "1.0.0"
}
